{
  "tax_year": 2018,
  "matches": [
    {
      "date": "2019-02-01",
      "ticker": "GB00B3TYHH97",
      "quantity": "100",
      "proceeds": "19409.5",
      "allowable_cost": "18325.0",
      "gain_or_loss": "1084",
      "rule": "Section104"
    },
    {
      "date": "2019-06-01",
      "ticker": "GB00B3TYHH97",
      "quantity": "40",
      "proceeds": "7872.3",
      "allowable_cost": "7878.09",
      "gain_or_loss": "-6",
      "rule": "Section104"
    }
  ],
  "total_gain": "1084",
  "total_loss": "0",
  "net_gain": "1084",
  "holdings": []
}
