{
  "tax_year": 2018,
  "matches": [
    {
      "date": "2019-02-01",
      "ticker": "FOO",
      "quantity": "20",
      "proceeds": "0",
      "allowable_cost": "0",
      "gain_or_loss": "40",
      "rule": "BedAndBreakfast"
    }
  ],
  "total_gain": "40",
  "total_loss": "0",
  "net_gain": "40",
  "holdings": []
}
