{
  "tax_year": 2018,
  "matches": [
    {
      "date": "2019-12-01",
      "ticker": "GB00B3TYHH97",
      "quantity": "40",
      "proceeds": "480",
      "allowable_cost": "420",
      "gain_or_loss": "60",
      "rule": "Section104"
    },
    {
      "date": "2020-06-01",
      "ticker": "GB00B3TYHH97",
      "quantity": "100",
      "proceeds": "2500",
      "allowable_cost": "1960",
      "gain_or_loss": "540",
      "rule": "Section104"
    }
  ],
  "total_gain": "600",
  "total_loss": "0",
  "net_gain": "600",
  "holdings": []
}
