{
  "tax_year": 2018,
  "matches": [
    {
      "date": "2019-04-01",
      "ticker": "FOO",
      "quantity": "40",
      "proceeds": "240",
      "allowable_cost": "200",
      "gain_or_loss": "40",
      "rule": "Section104"
    }
  ],
  "total_gain": "40",
  "total_loss": "0",
  "net_gain": "40",
  "holdings": []
}
